{
  "$schema": "../../schemas/experiment-manifest.schema.json",
  "schema_version": 1,
  "id": "019-nim-object-type-cast",
  "issue": 44,
  "artifacts": [
    {"path": "README.md", "kind": "file"},
    {"path": "src/object_type_cast.nim", "kind": "file"},
    {"path": "tests/run_experiment.py", "kind": "file"},
    {"path": "observed/type-check-table.md", "kind": "file"},
    {"path": "observed/generated-c-excerpt.c", "kind": "file"},
    {"path": "observed/failed-cast-c-excerpt.c", "kind": "file"},
    {"path": "observed/toolchain-definition-excerpt.nim", "kind": "file"},
    {"path": "observed/commands-2026-09-11.txt", "kind": "file"},
    {"path": "observed/environment.txt", "kind": "file"},
    {"path": "observed/run-2026-09-11.txt", "kind": "file"}
  ],
  "ci": {
    "mode": "automated",
    "os": "macos-latest",
    "toolchain": {"kind": "nim", "version": "2.2.10"},
    "steps": [
      {
        "name": "build and verify Nim object type checks and casts",
        "argv": ["python3", "tests/run_experiment.py"],
        "timeout_seconds": 300,
        "stdout_contains": ["Nim object metadata, type checks, valid casts, and invalid-cast failure verified"]
      }
    ]
  }
}
