{
  "$schema": "../../schemas/experiment-manifest.schema.json",
  "schema_version": 1,
  "id": "013-nim-rust-struct",
  "issue": 56,
  "artifacts": [
    {"path": "README.md", "kind": "file"},
    {"path": "src/pair_api.nim", "kind": "file"},
    {"path": "src/c_caller.c", "kind": "file"},
    {"path": "src/rust_caller.rs", "kind": "file"},
    {"path": "tests/run_experiment.py", "kind": "file"},
    {"path": "observed/pair_api.h", "kind": "file"},
    {"path": "observed/generated-c-excerpt.c", "kind": "file"},
    {"path": "observed/c-macro-expansion.txt", "kind": "file"},
    {"path": "observed/environment.txt", "kind": "file"},
    {"path": "observed/symbols-linkage.txt", "kind": "file"},
    {"path": "observed/commands-2026-09-03.txt", "kind": "file"},
    {"path": "observed/run-2026-09-03.txt", "kind": "file"}
  ],
  "ci": {
    "mode": "automated",
    "os": "macos-latest",
    "toolchain": {"kind": "nim", "version": "2.2.10"},
    "steps": [
      {
        "name": "build and verify Nim library C/Rust callers",
        "argv": ["python3", "tests/run_experiment.py"],
        "timeout_seconds": 300,
        "stdout_contains": ["Nim library C/Rust scalar and by-value struct calls verified"]
      }
    ]
  }
}
