{
  "$schema": "../../schemas/experiment-manifest.schema.json",
  "schema_version": 1,
  "id": "014-nim-c-buffer",
  "issue": 55,
  "artifacts": [
    {"path": "README.md", "kind": "file"},
    {"path": "src/buffer_api.nim", "kind": "file"},
    {"path": "src/caller.c", "kind": "file"},
    {"path": "tests/run_experiment.py", "kind": "file"},
    {"path": "observed/buffer-contract.md", "kind": "file"},
    {"path": "observed/buffer_api.h", "kind": "file"},
    {"path": "observed/generated-c-excerpt.c", "kind": "file"},
    {"path": "observed/c-macro-expansion.txt", "kind": "file"},
    {"path": "observed/symbols-linkage.txt", "kind": "file"},
    {"path": "observed/commands-2026-09-04.txt", "kind": "file"},
    {"path": "observed/environment.txt", "kind": "file"},
    {"path": "observed/run-2026-09-04.txt", "kind": "file"}
  ],
  "ci": {
    "mode": "automated",
    "os": "macos-latest",
    "toolchain": {"kind": "nim", "version": "2.2.10"},
    "steps": [
      {
        "name": "build and verify Nim C buffer API",
        "argv": ["python3", "tests/run_experiment.py"],
        "timeout_seconds": 300,
        "stdout_contains": ["Nim C buffer pointer, length, capacity, and canaries verified"]
      }
    ]
  }
}
