{
  "$schema": "../../schemas/experiment-manifest.schema.json",
  "schema_version": 1,
  "id": "016-nim-string-copy",
  "issue": 49,
  "artifacts": [
    {"path": "README.md", "kind": "file"},
    {"path": "src/string_copy.nim", "kind": "file"},
    {"path": "tests/run_experiment.py", "kind": "file"},
    {"path": "observed/copy-boundary.md", "kind": "file"},
    {"path": "observed/generated-c-excerpt.c", "kind": "file"},
    {"path": "observed/runtime-c-excerpt.c", "kind": "file"},
    {"path": "observed/toolchain-definition-excerpt.nim", "kind": "file"},
    {"path": "observed/commands-2026-09-08.txt", "kind": "file"},
    {"path": "observed/environment.txt", "kind": "file"},
    {"path": "observed/run-2026-09-08.txt", "kind": "file"}
  ],
  "ci": {
    "mode": "automated",
    "os": "macos-latest",
    "toolchain": {"kind": "nim", "version": "2.2.10"},
    "steps": [
      {
        "name": "build and verify Nim string copy boundaries",
        "argv": ["python3", "tests/run_experiment.py"],
        "timeout_seconds": 300,
        "stdout_contains": ["Nim string pass, return, assignment, copy, mutation, and cleanup verified"]
      }
    ]
  }
}
